{"$id":"https://aurora.invalid/schemas/readiness/gtbi_v7_state_controller_receipt_v1","$schema":"https://json-schema.org/draft/2020-12/schema","additionalProperties":false,"properties":{"actor_id":{"minLength":1,"type":"string"},"arbitrary_command_execution_supported":{"const":false},"base_ref":{"const":"refs/heads/main"},"base_sha":{"pattern":"^[0-9a-f]{40}$","type":"string"},"branch_actions_applied":{"items":{"additionalProperties":false,"properties":{"branch_id":{"minLength":1,"type":"string"},"task_id":{"pattern":"^PREV7-[0-9]{4}$","type":"string"}},"required":["branch_id","task_id"],"type":"object"},"type":"array"},"controller_version":{"const":"gtbi_v7_readiness_state_controller_v1"},"gate_actions_applied":{"items":{"additionalProperties":false,"properties":{"gate_id":{"minLength":2,"type":"string"},"target_status":{"enum":["green","not_applicable"]}},"required":["gate_id","target_status"],"type":"object"},"type":"array"},"locked_data_accessed":{"const":false},"manifest_digest":{"pattern":"^sha256:[0-9a-f]{64}$","type":"string"},"manifest_id":{"minLength":1,"type":"string"},"output_sha256":{"additionalProperties":{"pattern":"^sha256:[0-9a-f]{64}$","type":"string"},"minProperties":1,"type":"object"},"receipt_digest":{"pattern":"^sha256:[0-9a-f]{64}$","type":"string"},"schema_version":{"const":"gtbi_v7_state_controller_receipt_v1"},"scientific_work_performed":{"const":false},"task_actions_applied":{"items":{"additionalProperties":false,"properties":{"target_status":{"enum":["done","cancelled"]},"task_id":{"pattern":"^PREV7-[0-9]{4}$","type":"string"}},"required":["task_id","target_status"],"type":"object"},"type":"array"},"transaction_id":{"minLength":1,"type":"string"}},"required":["schema_version","controller_version","manifest_id","manifest_digest","transaction_id","base_ref","base_sha","actor_id","task_actions_applied","branch_actions_applied","gate_actions_applied","output_sha256","scientific_work_performed","locked_data_accessed","arbitrary_command_execution_supported","receipt_digest"],"title":"gtbi_v7_state_controller_receipt_v1","type":"object"}
