{"actor_id":"github-user:271768688","arbitrary_command_execution_supported":false,"base_ref":"refs/heads/main","base_sha":"aab58451fc590dc710a874847219450666268a56","branch_actions_applied":[],"controller_version":"gtbi_v7_readiness_state_controller_v1","gate_actions_applied":[{"gate_id":"G1B","target_status":"green"}],"locked_data_accessed":false,"manifest_digest":"sha256:43d85841444693f1f6bd4b51a50afdeb521735995d9d3d34d52f56aa6f820d1b","manifest_id":"g1b-role-registry-close-v1","output_sha256":{"docs/readiness/gtbi-v7/conditional_branch_registry.csv":"sha256:28eeb746b44e22a17cc5db8c75a8a0b8ec7f7cf75a6ac957ca30bb9110cdde0f","docs/readiness/gtbi-v7/gate_events.jsonl":"sha256:80f0af64e1b2230222f949badb141d19d857e8f598a99f84f7e9875e32e7139a","docs/readiness/gtbi-v7/gate_status.csv":"sha256:ea65b03de20336285406c6b5a338375c388bffba538c2d2cede660f032282311","docs/readiness/gtbi-v7/task_attempts.jsonl":"sha256:75a761745cd47ad5ae028dc667023ce63707ca359d5b3d4efccd7faa6e897094","docs/readiness/gtbi-v7/task_delivery_manifest.csv":"sha256:29874779211ebc67f8e61e4c3c10b8802837d1f4f919b6f27235ffe5d9d56a37","docs/readiness/gtbi-v7/task_events.jsonl":"sha256:3327e28dbd7a996e4e3acf3c845972fa0be30d5cafdcd793867177db48559f35","docs/readiness/gtbi-v7/task_planning_inputs.csv":"sha256:c987b0627b5e55e5481c1ae4eebbce9d911915046b83e6ac199cac0f3765221e","docs/readiness/gtbi-v7/task_status.csv":"sha256:9eb4d13e42ae6bbed0314abf72e1db0d8a7fe22dfbf5112eadbdbc5c225dff16"},"receipt_digest":"sha256:2b3fa2b39ade56d5bb851b962d03fcc90f204ba9074dd4b84a1dac3f376a5123","schema_version":"gtbi_v7_state_controller_receipt_v1","scientific_work_performed":false,"task_actions_applied":[{"target_status":"done","task_id":"PREV7-0201"}],"transaction_id":"G1B_CLOSE-1"}
