{"actor_id":"github-user:271768688","arbitrary_command_execution_supported":false,"base_ref":"refs/heads/main","base_sha":"a3370fb0f26f4d82d795581f6acdf9185d059a2e","branch_actions_applied":[{"branch_id":"V6_INPUT_IDENTITY","task_id":"PREV7-0307"}],"controller_version":"gtbi_v7_readiness_state_controller_v1","gate_actions_applied":[],"locked_data_accessed":false,"manifest_digest":"sha256:725e816547b9181dcda5e16fb084718f5d8630bb6580a597845d07b4cfe8971d","manifest_id":"g2-v6-input-identity-no-baseline-v1","output_sha256":{"docs/readiness/gtbi-v7/conditional_branch_registry.csv":"sha256:c9017887e33fe1715b8dbf1ba40fc6aaf3e910c24ce9d172c10a579d8be1710f","docs/readiness/gtbi-v7/gate_events.jsonl":"sha256:3a0834c53c0d46e7ecf9b058ae06368bf976ecd067c9522de13471976002cf8f","docs/readiness/gtbi-v7/gate_status.csv":"sha256:30a23ed2f9ded042e649bd9655a320d008dbd587883648c6bd13ca85fd9b7f8b","docs/readiness/gtbi-v7/task_attempts.jsonl":"sha256:c357ec991da1249f4f8ae29914b200176d82ee6d2d21a6bde8290633fa3a4ac0","docs/readiness/gtbi-v7/task_delivery_manifest.csv":"sha256:fc7aa51b4e136f506075db6b1b05d903c9d3581efb47d952e70d8cce6b398067","docs/readiness/gtbi-v7/task_events.jsonl":"sha256:8ca2737a3162a2998064e06bb54fa7e5914c412c8f89b4e5bb11f76df60358b4","docs/readiness/gtbi-v7/task_planning_inputs.csv":"sha256:cd836407788bb4d3d58d505f0024003e32dde6f5e0c69bdc8c3becc0fefbe41d","docs/readiness/gtbi-v7/task_status.csv":"sha256:648ae86ef370719fb9d01043523be47e03016a6e28122f6e1a8d59aa3aab8d11"},"receipt_digest":"sha256:1b11845064eb952466d44fc1ba7728e792cd4564ca3749d57fe0784edceab6a0","schema_version":"gtbi_v7_state_controller_receipt_v1","scientific_work_performed":false,"task_actions_applied":[{"target_status":"done","task_id":"PREV7-0307"}],"transaction_id":"G2_CLOSE-7"}
