{"actor_id":"github-user:271768688","arbitrary_command_execution_supported":false,"base_ref":"refs/heads/main","base_sha":"74c3c2137783d5a9ce83884ba57f0c86a8dca498","branch_actions_applied":[],"controller_version":"gtbi_v7_readiness_state_controller_v1","gate_actions_applied":[{"gate_id":"G1A","target_status":"green"}],"locked_data_accessed":false,"manifest_digest":"sha256:5206efcc4e0582226c31b47fa0876377a37b26abb4f11d44a7a80e50d8ec9e5d","manifest_id":"g1a-identity-close-v1","output_sha256":{"docs/readiness/gtbi-v7/conditional_branch_registry.csv":"sha256:28eeb746b44e22a17cc5db8c75a8a0b8ec7f7cf75a6ac957ca30bb9110cdde0f","docs/readiness/gtbi-v7/gate_events.jsonl":"sha256:ff9edcda4b96b89a37b2415b41823ea86c2586786dd4766a2dbc7bdc48d49a45","docs/readiness/gtbi-v7/gate_status.csv":"sha256:8f87dc39fa3291443e361fabeb092158fe072670f9b1c33c6ab6d1efdcc653e3","docs/readiness/gtbi-v7/task_attempts.jsonl":"sha256:9d7192d0ea7ea4909a46f94fc0eb20ddb41fb907528e403a05ab30c31df356d4","docs/readiness/gtbi-v7/task_delivery_manifest.csv":"sha256:57e2ede73a56c9822459bfb3d67454f83593af1944f6aaf45638d97245fea8cf","docs/readiness/gtbi-v7/task_events.jsonl":"sha256:ef4462cf2db8e48b0005b2f34ba063b3357114eab60812f50c70e9f9c416f154","docs/readiness/gtbi-v7/task_planning_inputs.csv":"sha256:f273591a78b0067334ee93bd87b6c59e5f01f7c5a8c22458dee0b799840b5845","docs/readiness/gtbi-v7/task_status.csv":"sha256:b99b3a8065cce24f4a843192b513086728830f9fe59d0223519f477f715e7996"},"receipt_digest":"sha256:256b2893aa56fa2bd0b30bd61f972a4b24ea3511183d01b5c7e68ce183c4c102","schema_version":"gtbi_v7_state_controller_receipt_v1","scientific_work_performed":false,"task_actions_applied":[{"target_status":"done","task_id":"PREV7-0101"},{"target_status":"done","task_id":"PREV7-0102"},{"target_status":"done","task_id":"PREV7-0103"}],"transaction_id":"G1A_CLOSE-1"}
