{"actor_id":"github-user:271768688","arbitrary_command_execution_supported":false,"base_ref":"refs/heads/main","base_sha":"152258faa9b0e194238c437cd5270a387eb4c9cd","branch_actions_applied":[],"controller_version":"gtbi_v7_readiness_state_controller_v1","gate_actions_applied":[],"locked_data_accessed":false,"manifest_digest":"sha256:0195c8919f548ccf67252e6ac53a46067c8910064d377821b952f2a6813f7de2","manifest_id":"g3b-codeowners-owner-v1","output_sha256":{"docs/readiness/gtbi-v7/conditional_branch_registry.csv":"sha256:e67954c6e6d8f19ec7e518665236a506b4995a46176c27d928735849452c78cc","docs/readiness/gtbi-v7/gate_events.jsonl":"sha256:3a0834c53c0d46e7ecf9b058ae06368bf976ecd067c9522de13471976002cf8f","docs/readiness/gtbi-v7/gate_status.csv":"sha256:30a23ed2f9ded042e649bd9655a320d008dbd587883648c6bd13ca85fd9b7f8b","docs/readiness/gtbi-v7/task_attempts.jsonl":"sha256:f88e77abe0adfa12ef5f7f5f3046c299fcdbf18b282a7134988682f51283d6a5","docs/readiness/gtbi-v7/task_delivery_manifest.csv":"sha256:9cd3ac4e12bef908cfb326cbf1aed5403ee0e6cde41e55869a653b7523229ded","docs/readiness/gtbi-v7/task_events.jsonl":"sha256:ea2844d4f3d5e5ad4dda6dad03fc93eb1673624fa432ebabb7d582824b7e910f","docs/readiness/gtbi-v7/task_planning_inputs.csv":"sha256:425bd92409db3dc0bec64dc0852f6a7b77eb73785e5648bb94624072f4e2d5e8","docs/readiness/gtbi-v7/task_status.csv":"sha256:dc0da5579a6211b60ca002ad96400a44482b0c06ec38c355da2e19ef96ac2a8a"},"receipt_digest":"sha256:6535ca97161ee352f183cc61e5e6120ba90a8265130f11986edbce25c35a5204","schema_version":"gtbi_v7_state_controller_receipt_v1","scientific_work_performed":false,"task_actions_applied":[{"target_status":"done","task_id":"PREV7-0203"}],"transaction_id":"G3B_CLOSE-1"}
