{"actor_id":"github-user:271768688","arbitrary_command_execution_supported":false,"base_ref":"refs/heads/main","base_sha":"426533b7248602e054179049bcb53bd4f59e2464","branch_actions_applied":[],"controller_version":"gtbi_v7_readiness_state_controller_v1","gate_actions_applied":[],"locked_data_accessed":false,"manifest_digest":"sha256:8f018f381264251c22008f3859c8e0c49a25a2b0fd13c800d0a1d9df1365ee50","manifest_id":"g2-scientific-asset-contract-v1","output_sha256":{"docs/readiness/gtbi-v7/conditional_branch_registry.csv":"sha256:e67954c6e6d8f19ec7e518665236a506b4995a46176c27d928735849452c78cc","docs/readiness/gtbi-v7/gate_events.jsonl":"sha256:3a0834c53c0d46e7ecf9b058ae06368bf976ecd067c9522de13471976002cf8f","docs/readiness/gtbi-v7/gate_status.csv":"sha256:30a23ed2f9ded042e649bd9655a320d008dbd587883648c6bd13ca85fd9b7f8b","docs/readiness/gtbi-v7/task_attempts.jsonl":"sha256:e757e6a9996d3c16aa6511686f0b350340493a20b119e86c1aba43ef03052da4","docs/readiness/gtbi-v7/task_delivery_manifest.csv":"sha256:fd76370590bfc060813a7d0e10068206780ce8ed0b37cf464f2b785e0d75830c","docs/readiness/gtbi-v7/task_events.jsonl":"sha256:2aad83e840b43cb54a3a76a77ec35f39a119e5512dd2d7b9ca9a97ebe7f1514d","docs/readiness/gtbi-v7/task_planning_inputs.csv":"sha256:aa992f18c1deae98b9e81fb91ccad49b14a22b5da76b9a3064da6dee45a18069","docs/readiness/gtbi-v7/task_status.csv":"sha256:8074ef028796fdfe51bc3fd6d39ee4c7518778aefd3e173e98c7fc720c9e327b"},"receipt_digest":"sha256:4e8bc79464a521b6e55de97bf70ff71fb6dd53940e6c1eff409189873181beb2","schema_version":"gtbi_v7_state_controller_receipt_v1","scientific_work_performed":false,"task_actions_applied":[{"target_status":"done","task_id":"PREV7-0303"}],"transaction_id":"G2_CLOSE-3"}
