{"actor_id":"github-user:271768688","arbitrary_command_execution_supported":false,"base_ref":"refs/heads/main","base_sha":"3b6bf272516cbf2cc7c7bafee9c4dfdd80ac7ade","branch_actions_applied":[{"branch_id":"V6_FINAL_SOURCE","task_id":"PREV7-0003"},{"branch_id":"EMERGENCY_ESCROW","task_id":"PREV7-0012"},{"branch_id":"G0_BOOTSTRAP_DISPOSITION","task_id":"PREV7-0011"}],"controller_version":"gtbi_v7_readiness_state_controller_v1","gate_actions_applied":[{"gate_id":"G0","target_status":"green"}],"locked_data_accessed":false,"manifest_digest":"sha256:15a37982115ed20364baf2f3317ab76e55a64eef295a7aae045031a63dde5838","manifest_id":"g0-owner-close-v1","output_sha256":{"docs/readiness/gtbi-v7/conditional_branch_registry.csv":"sha256:28eeb746b44e22a17cc5db8c75a8a0b8ec7f7cf75a6ac957ca30bb9110cdde0f","docs/readiness/gtbi-v7/gate_events.jsonl":"sha256:d6f2e652435c94125b846eaf991e6fee4630b2216f5d52e94253dd73f0aa74c0","docs/readiness/gtbi-v7/gate_status.csv":"sha256:426ed0b464cd46995b01f85e41a9e3e2d0e8b725fe884824d08c70cfb503b62e","docs/readiness/gtbi-v7/task_attempts.jsonl":"sha256:7f742bf30edae80297c765ccb61841f75271f418176a9d3b85b939d2a5c5bbc0","docs/readiness/gtbi-v7/task_delivery_manifest.csv":"sha256:a2806b9f1c8cea48159413f08e804f49fd207911c8b6fea1dd5ace270c33d4de","docs/readiness/gtbi-v7/task_events.jsonl":"sha256:68105af8984b0d127ea4c0d39126c29641c1753977c7051dc96671ba7ca7e66f","docs/readiness/gtbi-v7/task_planning_inputs.csv":"sha256:cdef0ba2f196c7a14cc8a44188714ebd664dc2c412414bb9abea4e9fbd534117","docs/readiness/gtbi-v7/task_status.csv":"sha256:2dc3d8bdeb276df7ee7135c3999170eb78b6972e896ec7d64fcb4062efefb059"},"receipt_digest":"sha256:cd78878279b98c1e11c2de58ae3790a453e051744c7096a1f8a57957bc8e8dd9","schema_version":"gtbi_v7_state_controller_receipt_v1","scientific_work_performed":false,"task_actions_applied":[{"target_status":"done","task_id":"PREV7-0001"},{"target_status":"done","task_id":"PREV7-0002"},{"target_status":"done","task_id":"PREV7-0009"},{"target_status":"done","task_id":"PREV7-0006"},{"target_status":"done","task_id":"PREV7-0010"},{"target_status":"done","task_id":"PREV7-0007"},{"target_status":"done","task_id":"PREV7-0008"},{"target_status":"done","task_id":"PREV7-0003"},{"target_status":"done","task_id":"PREV7-0004"},{"target_status":"done","task_id":"PREV7-0005"},{"target_status":"done","task_id":"PREV7-0012"},{"target_status":"cancelled","task_id":"PREV7-0011"}],"transaction_id":"G0_CLOSE-2"}
