{"actor_id":"github-user:271768688","arbitrary_command_execution_supported":false,"base_ref":"refs/heads/main","base_sha":"d5c76e2a297a01921dc6ad33b7665dd624b595dd","branch_actions_applied":[],"controller_version":"gtbi_v7_readiness_state_controller_v1","gate_actions_applied":[],"locked_data_accessed":false,"manifest_digest":"sha256:50ddba0f98d66ef25c24407ccf8ce88a1ba8e64ed76ff57e57c286746fb25deb","manifest_id":"g3b-stage-two-owner-v1","output_sha256":{"docs/readiness/gtbi-v7/conditional_branch_registry.csv":"sha256:e67954c6e6d8f19ec7e518665236a506b4995a46176c27d928735849452c78cc","docs/readiness/gtbi-v7/gate_events.jsonl":"sha256:3a0834c53c0d46e7ecf9b058ae06368bf976ecd067c9522de13471976002cf8f","docs/readiness/gtbi-v7/gate_status.csv":"sha256:30a23ed2f9ded042e649bd9655a320d008dbd587883648c6bd13ca85fd9b7f8b","docs/readiness/gtbi-v7/task_attempts.jsonl":"sha256:4634653952f681d4376fd8481fbfbfe71cb35de82386037e0c0e2c306c353272","docs/readiness/gtbi-v7/task_delivery_manifest.csv":"sha256:fe742de58e983e4b27543f21ce041968e604d9c371ce42c33208e98fa30cc8d6","docs/readiness/gtbi-v7/task_events.jsonl":"sha256:a61b5804b6f7f683eb7c9f204ac61d692ad951585ccbd3338546a0e5ce1a28bb","docs/readiness/gtbi-v7/task_planning_inputs.csv":"sha256:e6f8aa65b63d98f045c1be1893d1488b58545b07629bfdab2f2cda5e9f03e8ec","docs/readiness/gtbi-v7/task_status.csv":"sha256:b55ce5cc02b69444b44ad098d4febaab6e28561890cb7ad5ce36cc8da79bdad3"},"receipt_digest":"sha256:0456ccb984b7a1cfd003a286791be089f4e55fd6974c8e70bdb0a1458ba343d5","schema_version":"gtbi_v7_state_controller_receipt_v1","scientific_work_performed":false,"task_actions_applied":[{"target_status":"done","task_id":"PREV7-0207"}],"transaction_id":"G3B_CLOSE-2"}
