{"actor_id":"github-user:271768688","arbitrary_command_execution_supported":false,"base_ref":"refs/heads/main","base_sha":"c3a6b29be87f32f9037db6dc1608b18b21b40adc","branch_actions_applied":[],"controller_version":"gtbi_v7_readiness_state_controller_v1","gate_actions_applied":[],"locked_data_accessed":false,"manifest_digest":"sha256:f264ce80c4cd36d1f2b8c6dec6eb70d1a51fb97c634bc35824e6e7a004e9dd9d","manifest_id":"state-controller-smoke-v1","output_sha256":{"docs/readiness/gtbi-v7/conditional_branch_registry.csv":"sha256:54b463d6c4c9cd3ba1671814e080a054073e6c163d59b66b7e9742983dba173f","docs/readiness/gtbi-v7/gate_events.jsonl":"sha256:c44d301398250d24c12e0cd201c78d269accd64d59d9b5349b7b1a6b03b55f8a","docs/readiness/gtbi-v7/gate_status.csv":"sha256:9831dea6e75e9d7d8a2f09bbf5aaddc08e2e955e4648d53385759032a36bb7f3","docs/readiness/gtbi-v7/task_attempts.jsonl":"sha256:61b6f05b3979f49b842d9c9600255cd6912c8561adc3feada9b6f3ab28de7044","docs/readiness/gtbi-v7/task_delivery_manifest.csv":"sha256:2dbdcda6ebb2e9fde7b99670f6554b19720af631858bd1868411998ae96491dc","docs/readiness/gtbi-v7/task_events.jsonl":"sha256:c5c385515e95e4f3e361895fdb2f7ab00d8815843edac07ccdf34b29b8359c19","docs/readiness/gtbi-v7/task_planning_inputs.csv":"sha256:1b93cf8b581a9bc3c23b940dad23b4560cd74c21df00f906317ef383f12710a4","docs/readiness/gtbi-v7/task_status.csv":"sha256:b2196e1153bd5f80e6b05d8342e5481150abebd69f0aee049c6054263f7ae4a2"},"receipt_digest":"sha256:8e4de9f3b708372be7c6ff4396ddffb9ead2445e9ce3e41d1238befd9242d6bd","schema_version":"gtbi_v7_state_controller_receipt_v1","scientific_work_performed":false,"task_actions_applied":[{"target_status":"done","task_id":"PREV7-0001"}],"transaction_id":"G0_CLOSE-1"}
