{"actor_id":"github-user:271768688","arbitrary_command_execution_supported":false,"base_ref":"refs/heads/main","base_sha":"6a233ebada860d971aa3b1a43fde6afa6ad5807d","branch_actions_applied":[],"controller_version":"gtbi_v7_readiness_state_controller_v1","gate_actions_applied":[],"locked_data_accessed":false,"manifest_digest":"sha256:09f94e5cd586dbe41137e619bb8104643c3f7a91f9c096ec5ae8f16764c3eafa","manifest_id":"g2-v6-production-promotion-restore-v1","output_sha256":{"docs/readiness/gtbi-v7/conditional_branch_registry.csv":"sha256:e67954c6e6d8f19ec7e518665236a506b4995a46176c27d928735849452c78cc","docs/readiness/gtbi-v7/gate_events.jsonl":"sha256:3a0834c53c0d46e7ecf9b058ae06368bf976ecd067c9522de13471976002cf8f","docs/readiness/gtbi-v7/gate_status.csv":"sha256:30a23ed2f9ded042e649bd9655a320d008dbd587883648c6bd13ca85fd9b7f8b","docs/readiness/gtbi-v7/task_attempts.jsonl":"sha256:7526593a37bcdc261005c3276cd614f75d7b17a44557c67bd224a112cd53aacc","docs/readiness/gtbi-v7/task_delivery_manifest.csv":"sha256:78b95629e11bfa1edf335163746c0fd86ea9455401366d139d7b0c4dd4bc3c68","docs/readiness/gtbi-v7/task_events.jsonl":"sha256:36001f75bf5bf23f51a3ca815834b3bc0916a105f5f6e3aba2754c44b7e8ee26","docs/readiness/gtbi-v7/task_planning_inputs.csv":"sha256:c34a1bb87576d5a714f98146936d917260c264fc717ee68de3d0db030803c462","docs/readiness/gtbi-v7/task_status.csv":"sha256:d421143d052ce22269b2a874eac91121b11f25f8e84cf9edbb22bdd9352678d6"},"receipt_digest":"sha256:43e06243d1c48b1ef734aad2f78ecacf4e10ac4e84721bd7d52afe4d136e58ff","schema_version":"gtbi_v7_state_controller_receipt_v1","scientific_work_performed":false,"task_actions_applied":[{"target_status":"done","task_id":"PREV7-0304"},{"target_status":"done","task_id":"PREV7-0305"}],"transaction_id":"G2_CLOSE-5"}
