{"actor_id":"github-user:271768688","arbitrary_command_execution_supported":false,"base_ref":"refs/heads/main","base_sha":"dfb68f34b5f9746325cf43317b134bb1ab6326aa","branch_actions_applied":[{"branch_id":"APP_PRIVATE_KEY_IMPORT","task_id":"PREV7-0204"}],"controller_version":"gtbi_v7_readiness_state_controller_v1","gate_actions_applied":[{"gate_id":"G3A","target_status":"green"}],"locked_data_accessed":false,"manifest_digest":"sha256:3a3811b6a3523186b27a87ff9d6b265c4a65c920019757f5ddefe4ca73e8f245","manifest_id":"g3a-owner-auth-close-v1","output_sha256":{"docs/readiness/gtbi-v7/conditional_branch_registry.csv":"sha256:e67954c6e6d8f19ec7e518665236a506b4995a46176c27d928735849452c78cc","docs/readiness/gtbi-v7/gate_events.jsonl":"sha256:3a0834c53c0d46e7ecf9b058ae06368bf976ecd067c9522de13471976002cf8f","docs/readiness/gtbi-v7/gate_status.csv":"sha256:30a23ed2f9ded042e649bd9655a320d008dbd587883648c6bd13ca85fd9b7f8b","docs/readiness/gtbi-v7/task_attempts.jsonl":"sha256:3b51e92c83739c6a6bf64c84e53f14b2f039d79ce641f785a21cb459f3805c2b","docs/readiness/gtbi-v7/task_delivery_manifest.csv":"sha256:b7a2a4b876a3739383b3e0cfa0bf7999fbc4df6fdfeab71f9424adaae2f7ebf5","docs/readiness/gtbi-v7/task_events.jsonl":"sha256:6fd66f6a7e6cdae9e17fc239679a0694e5fa659b48aa82bf266909b7eae43c5b","docs/readiness/gtbi-v7/task_planning_inputs.csv":"sha256:51ea7bb3ba1c9088c844522288aca18bb459b60954d5173c3ef9c8a80e1f579a","docs/readiness/gtbi-v7/task_status.csv":"sha256:e0845912f609cd914ba168df72a1ef4b82938dc2d439dd68cce10e338abcfdd4"},"receipt_digest":"sha256:09968b1aa960d762c7d7f39d89b0067667a8e8b0888b432945cd886bcd9755a2","schema_version":"gtbi_v7_state_controller_receipt_v1","scientific_work_performed":false,"task_actions_applied":[{"target_status":"done","task_id":"PREV7-0204"},{"target_status":"done","task_id":"PREV7-0210"}],"transaction_id":"G3A_CLOSE-2"}
