{"actor_id":"github-user:271768688","arbitrary_command_execution_supported":false,"base_ref":"refs/heads/main","base_sha":"42c1ea844692de30c5ab52519ebce6c6638df988","branch_actions_applied":[],"controller_version":"gtbi_v7_readiness_state_controller_v1","gate_actions_applied":[],"locked_data_accessed":false,"manifest_digest":"sha256:ebdda08c871b844ff5685191742cac08019741a7879b04d0494a7b7ee1a8243c","manifest_id":"g2-provider-terms-acceptance-v1","output_sha256":{"docs/readiness/gtbi-v7/conditional_branch_registry.csv":"sha256:e67954c6e6d8f19ec7e518665236a506b4995a46176c27d928735849452c78cc","docs/readiness/gtbi-v7/gate_events.jsonl":"sha256:3a0834c53c0d46e7ecf9b058ae06368bf976ecd067c9522de13471976002cf8f","docs/readiness/gtbi-v7/gate_status.csv":"sha256:30a23ed2f9ded042e649bd9655a320d008dbd587883648c6bd13ca85fd9b7f8b","docs/readiness/gtbi-v7/task_attempts.jsonl":"sha256:16e8afb1eebd2a3a3452e0a45a94e26cae8db030fe4dd47d01a0fdbfead6118d","docs/readiness/gtbi-v7/task_delivery_manifest.csv":"sha256:b2fe1accc03b1e221d11a345abb06385f20dba57ee025589c597248501e02536","docs/readiness/gtbi-v7/task_events.jsonl":"sha256:d9ddbd2354dbcb2f60afa75341c852014f1e42f7eb784eaf237a263900825e84","docs/readiness/gtbi-v7/task_planning_inputs.csv":"sha256:1f2a9d12aee09a06cca304e2946f6022b2bee5656ecb62489ce2a049378d8b54","docs/readiness/gtbi-v7/task_status.csv":"sha256:9be2ed30c27dc78d231840d1ce6c2523c0de4bb7c51f994951badaa6d99ab236"},"receipt_digest":"sha256:9c3cef688472a652eafe852a28ec2d9aed62b3036740970c795ed6d5debdacd7","schema_version":"gtbi_v7_state_controller_receipt_v1","scientific_work_performed":false,"task_actions_applied":[{"target_status":"done","task_id":"PREV7-0302"}],"transaction_id":"G2_CLOSE-4"}
