{"actor_id":"github-user:271768688","arbitrary_command_execution_supported":false,"base_ref":"refs/heads/main","base_sha":"dc2f4965ea3adfae3e93bf3222fbe30c0ad37362","branch_actions_applied":[{"branch_id":"CAPACITY_TOPOLOGY","task_id":"PREV7-0309"}],"controller_version":"gtbi_v7_readiness_state_controller_v1","gate_actions_applied":[],"locked_data_accessed":false,"manifest_digest":"sha256:e4b3641ca10b90f0defb6d408983cd586695cc060b85d6832a082d6162d3a99c","manifest_id":"g2-github-actions-envelope-v1","output_sha256":{"docs/readiness/gtbi-v7/conditional_branch_registry.csv":"sha256:ee8f5a6bdb4a959db104b567de6df4ac848619501fe04e2a7a7d656a369188e7","docs/readiness/gtbi-v7/gate_events.jsonl":"sha256:3a0834c53c0d46e7ecf9b058ae06368bf976ecd067c9522de13471976002cf8f","docs/readiness/gtbi-v7/gate_status.csv":"sha256:30a23ed2f9ded042e649bd9655a320d008dbd587883648c6bd13ca85fd9b7f8b","docs/readiness/gtbi-v7/task_attempts.jsonl":"sha256:454de8818caa6f3bda6869c1b0f588da80cd1336ee841fa4d48b786913e58c35","docs/readiness/gtbi-v7/task_delivery_manifest.csv":"sha256:02de6215ed3cc976902913e490e0994c0704c0481dfdabd43c4b89f782b9ba48","docs/readiness/gtbi-v7/task_events.jsonl":"sha256:98561435d5cb1dc46676c4abdb21799ca16e96ef8160d59f6eb13e7a111ca3ed","docs/readiness/gtbi-v7/task_planning_inputs.csv":"sha256:6ba33023cf3fceb6cf483ce3a5d5c08ce2b14c2424f657790e47c5480c64bd6e","docs/readiness/gtbi-v7/task_status.csv":"sha256:b56ff7e52572bd2a47e0b4282b0d6967ee45e49aba68427854c6a47ab513c19d"},"receipt_digest":"sha256:5393c1d8be865c83cf7f8a1c1e164fff5c978a0940dd4c5a85cd665b6653e999","schema_version":"gtbi_v7_state_controller_receipt_v1","scientific_work_performed":false,"task_actions_applied":[{"target_status":"done","task_id":"PREV7-0309"}],"transaction_id":"G2_CLOSE-6"}
