{"actor_id":"github-user:271768688","arbitrary_command_execution_supported":false,"base_ref":"refs/heads/main","base_sha":"469a74f28bb6ade4a8331b7b43a20f871ba6074e","branch_actions_applied":[],"controller_version":"gtbi_v7_readiness_state_controller_v1","gate_actions_applied":[],"locked_data_accessed":false,"manifest_digest":"sha256:7fd354440d0d39b2805756fdcba28089f3534bdcad00ceb63cff0a101befb3a1","manifest_id":"g3a-minimum-governance-close-v1","output_sha256":{"docs/readiness/gtbi-v7/conditional_branch_registry.csv":"sha256:28eeb746b44e22a17cc5db8c75a8a0b8ec7f7cf75a6ac957ca30bb9110cdde0f","docs/readiness/gtbi-v7/gate_events.jsonl":"sha256:80f0af64e1b2230222f949badb141d19d857e8f598a99f84f7e9875e32e7139a","docs/readiness/gtbi-v7/gate_status.csv":"sha256:ea65b03de20336285406c6b5a338375c388bffba538c2d2cede660f032282311","docs/readiness/gtbi-v7/task_attempts.jsonl":"sha256:30c8f9c796f012ef78018665ebef4405e3ad8c11d88544494cc239e5a1635f7d","docs/readiness/gtbi-v7/task_delivery_manifest.csv":"sha256:4eea03f4879db8d76fbac88faa7206c69fcfbc457e85d36f4fc9eca3ad800a8d","docs/readiness/gtbi-v7/task_events.jsonl":"sha256:b92c0ffa3b21e08605181dcd23e0e3c79947d6ed638cf2c176fad0a4cd1411e4","docs/readiness/gtbi-v7/task_planning_inputs.csv":"sha256:5ad9890ea1e92cea5da689c1775179dfae989ebbadf8e1fa595ed5863a33089d","docs/readiness/gtbi-v7/task_status.csv":"sha256:66eeb6214e20754b909c5a5ada8dbf208c4a3d1b1bfc8a0fffa6b63ce2356991"},"receipt_digest":"sha256:d93bc3b428b938f3cf7ef12b30a0dde49b6dfce25710f3560c356154d2dc9837","schema_version":"gtbi_v7_state_controller_receipt_v1","scientific_work_performed":false,"task_actions_applied":[{"target_status":"done","task_id":"PREV7-0202"},{"target_status":"done","task_id":"PREV7-0205"},{"target_status":"done","task_id":"PREV7-0206"}],"transaction_id":"G3A_CLOSE-1"}
