{"actor_id":"github-user:271768688","arbitrary_command_execution_supported":false,"base_ref":"refs/heads/main","base_sha":"f972d19e90113201ef2a773d8348923255d13e68","branch_actions_applied":[],"controller_version":"gtbi_v7_readiness_state_controller_v1","gate_actions_applied":[],"locked_data_accessed":false,"manifest_digest":"sha256:01a7a0a2b92d08c46791539269db8022e0ad744836e214e9cd6b2aef9222fdd1","manifest_id":"g2-retention-policy-v1","output_sha256":{"docs/readiness/gtbi-v7/conditional_branch_registry.csv":"sha256:e67954c6e6d8f19ec7e518665236a506b4995a46176c27d928735849452c78cc","docs/readiness/gtbi-v7/gate_events.jsonl":"sha256:3a0834c53c0d46e7ecf9b058ae06368bf976ecd067c9522de13471976002cf8f","docs/readiness/gtbi-v7/gate_status.csv":"sha256:30a23ed2f9ded042e649bd9655a320d008dbd587883648c6bd13ca85fd9b7f8b","docs/readiness/gtbi-v7/task_attempts.jsonl":"sha256:da9d9313ea3bc647af43fcc1e3134e644d5879d9efa9308083fc69db2f3e432a","docs/readiness/gtbi-v7/task_delivery_manifest.csv":"sha256:aa09eeb51eccb452b01a42e5d9799a4c85590077750bbf6055dfa2194ab1b2d8","docs/readiness/gtbi-v7/task_events.jsonl":"sha256:6794f0dfd76d7db66d37812e10b58ebd9b17e0d510e0a2d7a152ad889fd73ac9","docs/readiness/gtbi-v7/task_planning_inputs.csv":"sha256:773ccd94187e5a7a810f9039ffaa2bb9ca0b686b2fee8ae2529c3cdfadcd11cd","docs/readiness/gtbi-v7/task_status.csv":"sha256:a06420a0f7d6c547154c594e8490d2a0edc6292334ba981c0bff407076e972d9"},"receipt_digest":"sha256:a0b877bc49e23bfdef7178e397c844967386b4f6d65791341bdad8fb4f544dd4","schema_version":"gtbi_v7_state_controller_receipt_v1","scientific_work_performed":false,"task_actions_applied":[{"target_status":"done","task_id":"PREV7-0301"}],"transaction_id":"G2_CLOSE-2"}
