{"actor_id":"github-user:271768688","arbitrary_command_execution_supported":false,"base_ref":"refs/heads/main","base_sha":"9beb98c960f9356fe706c1f987cd3d336dbd5781","branch_actions_applied":[],"controller_version":"gtbi_v7_readiness_state_controller_v1","gate_actions_applied":[],"locked_data_accessed":false,"manifest_digest":"sha256:d1bf21854d7f2c52c690d46dcdf1001a533afc4303986a3e426932bbb1b311ad","manifest_id":"g2-reproducibility-classification-v1","output_sha256":{"docs/readiness/gtbi-v7/conditional_branch_registry.csv":"sha256:e67954c6e6d8f19ec7e518665236a506b4995a46176c27d928735849452c78cc","docs/readiness/gtbi-v7/gate_events.jsonl":"sha256:3a0834c53c0d46e7ecf9b058ae06368bf976ecd067c9522de13471976002cf8f","docs/readiness/gtbi-v7/gate_status.csv":"sha256:30a23ed2f9ded042e649bd9655a320d008dbd587883648c6bd13ca85fd9b7f8b","docs/readiness/gtbi-v7/task_attempts.jsonl":"sha256:08e0a32de38880ecc88b18d0f69e86832caecb694fe423363668115587dbb6d2","docs/readiness/gtbi-v7/task_delivery_manifest.csv":"sha256:cf133955b1131d29f4842dca18c11976b3e51f90a4993a538b585344758c033e","docs/readiness/gtbi-v7/task_events.jsonl":"sha256:b6daa60f80a5ff7e5c6d2a8d56add292b1693dbfc5cd6b097a1c4c7b4c55a1be","docs/readiness/gtbi-v7/task_planning_inputs.csv":"sha256:f026374b1770e2fc2c34a6375af695f903dea62cd5e102abdd33bbfdc44ae4d5","docs/readiness/gtbi-v7/task_status.csv":"sha256:4f3fdd230d844db82772fe8f6769bcceaeff56ccbe90a64675b3be168b073c09"},"receipt_digest":"sha256:5c82824c95f0a15a0ec79ebcd9e885fce41b3842340465eb16e2329696910b45","schema_version":"gtbi_v7_state_controller_receipt_v1","scientific_work_performed":false,"task_actions_applied":[{"target_status":"done","task_id":"PREV7-0306"}],"transaction_id":"G2_CLOSE-1"}
